{"canonical_json_profile":"pcs-jcs-rfc8785-v1","certificate_integrity_hash":"f5c09ba94132557896fe6ea5e8b5e381ce3bffe957ce2f35d1acdb04532fce63","certificate_integrity_hash_format":"pcs-certificate-integrity-sha256-v2","certificate_semantic_hash":"6ada628fd1f02fe14eff89648ef50bf913f64d463c0022ac24dcaa3305521be5","certificate_semantic_hash_format":"pcs-certificate-semantic-sha256-v2","certificate_spec_version":"pcs-0.6","files":{"artifacts/agent_trace.bin":{"sha256":"abd1b39dd8e1a059fae98cb452fc83244ee6518c5886a1b1d18292b6ecf0c756","size":6},"certificate.json":{"sha256":"bb333df480dbdf6e872471c02f5891047c128f9b82daf487d0e5e3c9408d0652","size":1658},"normalized/ab861dc170dc2e43224e45278d3d31a675b9ebc34c9b0f48c066ca1eeaed8ee6.json":{"sha256":"0cc7663624a7b63b5839aa42bdced5ca642cb7c2877fb0b8fa2591e9eed52281","size":1108},"normalized/index.json":{"sha256":"a2649a3b505149e352e2e8b67fb54603e1282258748e941f9ea1d83b112f77a5","size":677}},"package_format":"pcs-package-v2"}